{
  "schema_version": 1,
  "id": "I-001",
  "about": "actor:real_estate_agent",
  "claim": "Môi giới xử lý lead trong khoảng thời gian rất ngắn và chủ yếu trên mobile",
  "source": {
    "type": "analytics",
    "ref": "ga4:sessions-2026-08"
  },
  "evidence": [
    "71% phiên là mobile (30 ngày, 2026-08)",
    "4 phỏng vấn 2026-08-12..19: cả 4 gọi khách trong <5 phút sau khi nhận lead"
  ],
  "confidence": "high",
  "wouldChangeIf": {
    "kind": "predicate",
    "text": "runs[viewport=desktop] / runs[*] > 0.4 trong 30 ngày"
  },
  "lastCheck": {
    "at": "2026-09-25T08:41:12Z",
    "fired": false,
    "observed": 0.23
  },
  "reviewAfter": null
}
