{
  "schema_version": 1,
  "id": "I-002",
  "about": "actor:real_estate_agent",
  "claim": "Môi giới thích xem lead dạng kanban hơn dạng danh sách",
  "source": {
    "type": "opinion",
    "ref": "decision-2026-06-02"
  },
  "evidence": [
    "ý kiến PO, không có số"
  ],
  "confidence": "hypothesis",
  "wouldChangeIf": {
    "kind": "predicate",
    "text": "phiên dùng list view > 60% trong 30 ngày"
  },
  "lastCheck": {
    "at": "2026-09-24T09:12:03Z",
    "fired": true,
    "observed": 0.71
  },
  "demotedAt": "2026-09-24T09:12:03Z",
  "propagatedTo": [
    "commitments/C-003.json"
  ]
}
